{
  "schemaVersion": 1,
  "id": "cogweave-ring",
  "name": "Cogweave Ring",
  "description": "An articulated ring that steadies intricate work.",
  "slot": "accessory",
  "rarity": "uncommon",
  "level": 2,
  "value": 35,
  "stackLimit": 1,
  "modifiers": [
    {
      "stat": "precision",
      "operation": "flat",
      "value": 2
    }
  ],
  "grantedSkillIds": [],
  "consumedOnUse": false
}
